<!--

    Copyright 2011-2013 Universite Joseph Fourier, LIG, ADELE team
      Licensed under the Apache License, Version 2.0 (the "License");
      you may not use this file except in compliance with the License.
      You may obtain a copy of the License at

        http://www.apache.org/licenses/LICENSE-2.0

      Unless required by applicable law or agreed to in writing, software
      distributed under the License is distributed on an "AS IS" BASIS,
      WITHOUT WARRANTIES OR CONDITIONS OF ANY KIND, either express or implied.
      See the License for the specific language governing permissions and
      limitations under the License.

-->
<apam xmlns="fr.imag.adele.apam" xmlns:ipojo="org.apache.felix.ipojo"
xmlns:xsi="http://www.w3.org/2001/XMLSchema-instance"
 xsi:schemaLocation="fr.imag.adele.apam https://raw.github.com/AdeleResearchGroup/ApAM/master/runtime/core/src/main/resources/xsd/ApamCore.xsd" >    

<!--  1° Devices : The Buttons -->
 	<specification name="Button"
	   interfaces="fr.imag.adele.apam.tutorials.lights.devices.SimpleButton"
	   messages="fr.imag.adele.apam.tutorials.lights.devices.messages.ButtonPressed">	   
 	   <definition name="location" type="kitchen, living, bedroom" />
 	   <definition name="name" type="string" />
	</specification>
	
	<implementation name="ButtonGUI"
		specification="Button"
		classname="fr.imag.adele.apam.tutorials.lights.button.SwingButtonImpl"
		push="pressButton">
        <callback onInit="started" onRemove="stopped"/>
		<definition name="location" type="kitchen, living, bedroom" field="myLocation"/>
        <!-- Use of predefined property of apam -->
        <definition name="name" type="string" field="myName"/>
	</implementation>

    <implementation name="ButtonNotGUI"
                    specification="Button"
                    classname="fr.imag.adele.apam.tutorials.lights.button.ButtonImpl"
                    push="pressButton">
        <callback onInit="started" onRemove="stopped"/>
        <definition name="location" type="kitchen, living, bedroom" field="myLocation"/>
        <!-- Use of predefined property of apam -->
        <definition name="name" type="string" field="myName"/>
    </implementation>

	<apam-instance implementation="ButtonGUI" name="buttonKitchen">
		<property name="location" value="kitchen"/>
	</apam-instance>

	<apam-instance implementation="ButtonNotGUI" name="buttonLivingOne">
		<property name="location" value="living"/>
	</apam-instance>

	<apam-instance implementation="ButtonNotGUI" name="buttonLivingTwo">
		<property name="location" value="living"/>
	</apam-instance>
	
	


<!-- 2° Devices : The Lights -->
 	<specification name="Light"
	   interfaces="fr.imag.adele.apam.tutorials.lights.devices.BinaryLight"
	   messages="fr.imag.adele.apam.tutorials.lights.devices.messages.LightStatusChanged">
 	   <definition name="location" type="kitchen, living, bedroom" />
 	   <definition name="name" type="string" />
	</specification>

	<implementation name="BinaryLightImpl"
		specification="Light"
		classname="fr.imag.adele.apam.tutorials.lights.binarylight.BinaryLightImpl"
		push="fireLightStatus">
		<callback onInit="started" onRemove="stopped"/>
		<definition name="location" type="kitchen, living, bedroom" field="myLocation"/>
        <!-- Use of predefined property of apam -->
        <definition name="name" type="string" field="myName"/>

    </implementation>
	
	<apam-instance implementation="BinaryLightImpl" name="lightKitchen">
		<property name="location" value="kitchen"/>
	</apam-instance>

	<apam-instance implementation="BinaryLightImpl" name="lightLivingOne">
		<property name="location" value="living"/>
	</apam-instance>
 
	<apam-instance implementation="BinaryLightImpl" name="lightLivingTwo">
		<property name="location" value="living"/>
	</apam-instance>
 	
<!--  3° Services : Light Application -->
	<implementation name="LightApplication"
		classname="fr.imag.adele.apam.tutorials.lights.services.LightingApplication">
		<callback onInit="start" onRemove="stop"/>
        <!-- Use of predefined property of apam -->
        <definition name="name" type="string" field="myName"/>		
		<relation name="depLights" specification="Light" field="theLights" multiple="true" added="newLight" resolve="exist"/>
        <relation name="depButtons" specification="Button" field="theButtons" multiple="true" added="newButton" removed="removeButton" resolve="exist">
			<message push="aButtonHasBeenPressed" />
		</relation>
	</implementation>

<!--  4° Services : Graphical Control Panel for the Devices -->
	<implementation name="LightManagerPanel"
		classname="fr.imag.adele.apam.tutorials.lights.panel.LightManagerPanel">
		<callback onInit="started" onRemove="stopped"/>
        <relation specification="Button" field="theButtons" multiple="true" added="newButton" removed="removeButton" resolve="exist"/>
		<relation  specification="Light" field="theLights" multiple="true" added="newLight" removed="removeLight" resolve="exist">
			<message push="aLightStatusHasChanged" />
		</relation>
	</implementation>

   <apam-instance implementation="LightManagerPanel" name="myPanel">
    </apam-instance>
	

<!-- 5° Composite : Rooms -->

	<composite name="Kitchen"
		singleton="true" >
		<contentMngt>
			<start implementation="LightApplication" name="myLightApplicationKitchen"/>
			<own specification="Button"  property="location" value="kitchen"  />
			<own specification="Light"  property="location" value="kitchen"/>
			<export instance="true"/>
			<import instance="false"/>	
					
		</contentMngt>
		
	</composite>

 	<composite name="Living"
		singleton="true">
		<contentMngt>
			<start implementation="LightApplication" name="myLightApplicationLiving"/>
			<own specification="Button"  property="location" value="living"/>
			<own specification="Light"  property="location" value="living"/>
			<export instance="true"/>
			<import instance="false"/>			
		</contentMngt>
	</composite>


 	<apam-instance implementation="Kitchen" name="myKitchen">
	</apam-instance>
	
	<apam-instance implementation="Living" name="myLiving">
	</apam-instance>

</apam>