<apam xmlns="fr.imag.adele.apam"
      xmlns:xsi="http://www.w3.org/2001/XMLSchema-instance"
      xsi:schemaLocation="fr.imag.adele.apam http://repository-apam.forge.cloudbees.com/release/schema/ApamCore.xsd">
    <!-- *********** ****************** -->
    <!--   Hello French Composite Type  -->
    <!-- *********** ****************** -->
    <composite name="hello-fr" main="hello-gui">

        <contentMngt>
            <dependency interface="fr.imag.adele.apam.hello.world.spec.HelloService">
                      <constraints>
                          <instance filter="(lang=fr)"/>
                      </constraints>
            </dependency>
        </contentMngt>
    </composite>

    <!-- *********** ****************** -->
    <!--   Hello Arabic Composite Type  -->
    <!-- *********** ****************** -->
    <composite name="hello-ar" main="hello-gui">

        <contentMngt>
            <dependency interface="fr.imag.adele.apam.hello.world.spec.HelloService">
                <constraints>
                    <instance filter="(lang=ar)"/>
                </constraints>
            </dependency>

        </contentMngt>
    </composite>


    <!-- *********** ****************** -->
    <!--   Hello English Composite Type  -->
    <!-- *********** ****************** -->
    <composite name="hello-en" main="hello-gui">

        <contentMngt>
            <dependency interface="fr.imag.adele.apam.hello.world.spec.HelloService">
                <constraints>
                    <instance filter="(lang=en)"/>
                </constraints>
            </dependency>

        </contentMngt>
    </composite>

    <!-- *********** ****************** -->
    <!--   Hello Spanish Composite Type  -->
    <!-- *********** ****************** -->
    <composite name="hello-es" main="hello-gui">

        <contentMngt>
            <dependency interface="fr.imag.adele.apam.hello.world.spec.HelloService">
                <constraints>
                    <instance filter="(lang=es)"/>
                </constraints>
            </dependency>

        </contentMngt>
    </composite>

    <!-- *********** ****************** -->
    <!--   Hello Portuguese Composite Type  -->
    <!-- *********** ****************** -->
    <composite name="hello-po" main="hello-gui">

        <contentMngt>
            <dependency interface="fr.imag.adele.apam.hello.world.spec.HelloService">
                <constraints>
                    <instance filter="(lang=po)"/>
                </constraints>
            </dependency>

        </contentMngt>
    </composite>

</apam>