<!--

    Copyright 2011-2012 Universite Joseph Fourier, LIG, ADELE team
      Licensed under the Apache License, Version 2.0 (the "License");
      you may not use this file except in compliance with the License.
      You may obtain a copy of the License at

        http://www.apache.org/licenses/LICENSE-2.0

      Unless required by applicable law or agreed to in writing, software
      distributed under the License is distributed on an "AS IS" BASIS,
      WITHOUT WARRANTIES OR CONDITIONS OF ANY KIND, either express or implied.
      See the License for the specific language governing permissions and
      limitations under the License.

-->
<apam xmlns="fr.imag.adele.apam" xmlns:ipojo="org.apache.felix.ipojo"
xmlns:xsi="http://www.w3.org/2001/XMLSchema-instance" 
 xsi:schemaLocation="fr.imag.adele.apam https://raw.github.com/AdeleResearchGroup/ApAM/master/runtime/core/src/main/resources/xsd/ApamCore.xsd" >    


	<specification name="STestAttr"
		interfaces="apam.test.attr.TestAttr">
		<definition name="S1-Enum" type="{s1-1, s1-2, s1-3}" />
		<property name="S1-Enum" value="s1-2"  />
		<definition name="S1-Attr" type="string" />
		<property name="S1-Attr" value="coucou" />
		<definition name="s1b" type="boolean" default="true" />
		<definition name="s1c" type="string" />
		<definition name="fieldAttr" type="string" />
<!-- 		<definition name="fieldAttr" type="string" value="specdefVal"/> -->
		
		<definition name="s1i" type="int" />
		<definition name="setint" type="{int}" />
		<definition name="location" type="living, kitchen, bedroom"	default="bedroom" />
		<definition name="testEnumere" type="{v1, v2, v3, v4}" />
		<definition name="OS" type="{Linux, Windows, Android, IOS}" />
	</specification>
	
	<specification name="CapteurTemp" interfaces="apam.test.attr.CapteurTemp, apam.test.attr.ConfCapteur">
		<definition name="description" 	type="string" />
		<property name="description" value="Un capteur de température …" />
		<definition name="unit" type="C, F" default="F" />
		<definition name="location" type="{living, kitchen, bedroom}" />
		<definition name="OS" type="{Linux, Windows, Android, IOS}" />
		<definition name="MyBool" type="boolean" />
	</specification>

</apam>