<apam xmlns="fr.imag.adele.apam" xmlns:ipojo="org.apache.felix.ipojo"
xmlns:xsi="http://www.w3.org/2001/XMLSchema-instance" 
 xsi:schemaLocation="fr.imag.adele.apam http://repository-apam.forge.cloudbees.com/release/schema/ApamCore.xsd" >    


	<composite name="CompoTestAttr" main="TestAttr"
		specification="STestAttr" interfaces="{fr.imag.adele.apam.TestAttr.S1TestAttr}" />

	<implementation name="TestAttr"
		classname="fr.imag.adele.apam.TestAttrImpl.S1ImplTestAttr" specification="STestAttr">
<!-- 		<property name="S1toS2Final-Attr" value="couscous" /> -->
		<property name="spec-name" value="yyy"  />
<!-- 		<property name="definition-xx" value="ttt" /> -->
<!-- 		<property name="s1b" value="xyze=" /> -->
<!-- 		<property name="OS" value="pas bon" /> -->
		<property name="testEnumere" value="v2" />
		<definition name="fieldAttr" field="theFieldAttr" internal="true" type="string" value="bidon"/>
		<definition name="S1toS2Final-Bool" type="boolean" value="true" />
		<definition name="S1toS2Final-String1" type="string" />
		<definition name="S1toS2Final-location" type="{FinalLiving, FinalKitchen, FinalLedroom}" />
		<definition name="enumeration" type="{f1, f2, f3, f4}" />
	</implementation>


<!-- 	<instance implementation="TestAttr" name="TestAttr_Instance" /> -->
		
		
</apam>

