<!-- Copyright Universite Joseph Fourier (www.ujf-grenoble.fr) Licensed under 
	the Apache License, Version 2.0 (the "License"); you may not use this file 
	except in compliance with the License. You may obtain a copy of the License 
	at http://www.apache.org/licenses/LICENSE-2.0 Unless required by applicable 
	law or agreed to in writing, software distributed under the License is distributed 
	on an "AS IS" BASIS, WITHOUT WARRANTIES OR CONDITIONS OF ANY KIND, either 
	express or implied. See the License for the specific language governing permissions 
	and limitations under the License. -->


<apam xmlns="fr.imag.adele.apam" xmlns:xsi="http://www.w3.org/2001/XMLSchema-instance"
	xsi:schemaLocation="fr.imag.adele.apam http://repository-apam.forge.cloudbees.com/release/schema/ApamCore.xsd">    
	<implementation name="S3Impl"
		classname="fr.imag.adele.apam.test.s3Impl.S3Impl" specification="S3">
		<property name="test" value="bof"/>
		<property name="shared" value="false"  />
		<dependency field="s5" />
		<definition name="S3Impl-Attr" type="string" />
		<property name="OS" value="Android" />
		<property name="location" value="living" />
		<property name="MyBool" value="true" />
		<dependency specification="S4">
			<interface field="s4" />
		</dependency>
	</implementation>

	<apam-instance implementation="S2Simple" name="S2Simple-inst-from-S3Impl">
		<!-- <property test-spec="coucous4" /> <property A2="yes" /> <property 
			c="xxx" /> -->
	</apam-instance>

	<implementation name="S3ImplAndroidLiving"
		classname="fr.imag.adele.apam.test.s3Impl.S3Impl" specification="DepS3">
		<property name="OS" value="Android" />
		<property name="location" value="living" />
	</implementation>
	
	<implementation name="S3ImplIOSLiving"
		classname="fr.imag.adele.apam.test.s3Impl.S3Impl" specification="DepS3">
		<property name="OS" value="Android" />
		<property name="location" value="living" />
	</implementation>
	
	<implementation name="S3ImplWindowsBedroom"
		classname="fr.imag.adele.apam.test.s3Impl.S3Impl" specification="DepS3">
		<property name="OS" value="Windows" />
		<property name="location" value="bedroom" />
	</implementation>
	
	<implementation name="S3ImplAndroidKitchen"
		classname="fr.imag.adele.apam.test.s3Impl.S3Impl" specification="DepS3">
		<property name="OS" value="IOS" />
		<property name="location" value="kitchen" />
	</implementation>
	
	<implementation name="S3ImplIOSKitchen"
		classname="fr.imag.adele.apam.test.s3Impl.S3Impl" specification="DepS3">
		<property name="OS" value="IOS" />
		<property name="location" value="kitchen" />
	</implementation>



<apam-instance implementation="S3ImplAndroidLiving" name="S3ImplAndroidLiving-0"/>
<apam-instance implementation="S3ImplIOSLiving" name="S3ImplIOSLiving-0"/>
<apam-instance implementation="S3ImplWindowsBedroom" name="S3ImplWindowsBedroom-0"/>
<apam-instance implementation="S3ImplAndroidKitchen" name="S3ImplAndroidKitchen-0"/>
<apam-instance implementation="S3ImplIOSKitchen" name="S3ImplIOSKitchen-0"/>

	<apam-instance implementation="S3Impl" name="S3Impl-instance">
	</apam-instance>

<!-- 	<apam-instance implementation="S3Impl" name="s3Impl-intAutre" /> -->
<!-- 	<apam-instance implementation="S3Impl" name="S3Impl-instance1" /> -->
<!-- 	<apam-instance implementation="S3Impl" name="S3Impl-instance2" /> -->
<!-- 	<apam-instance implementation="S3Impl" name="S3Impl-instance3" /> -->

</apam>

