<!--

    Copyright 2011-2012 Universite Joseph Fourier, LIG, ADELE team
      Licensed under the Apache License, Version 2.0 (the "License");
      you may not use this file except in compliance with the License.
      You may obtain a copy of the License at

        http://www.apache.org/licenses/LICENSE-2.0

      Unless required by applicable law or agreed to in writing, software
      distributed under the License is distributed on an "AS IS" BASIS,
      WITHOUT WARRANTIES OR CONDITIONS OF ANY KIND, either express or implied.
      See the License for the specific language governing permissions and
      limitations under the License.

-->
<apam xmlns="fr.imag.adele.apam" xmlns:ipojo="org.apache.felix.ipojo"
xmlns:xsi="http://www.w3.org/2001/XMLSchema-instance" 
 xsi:schemaLocation="fr.imag.adele.apam   http://repository-apam.forge.cloudbees.com/release/schema/ApamCore.xsd" >    

	<implementation name="W"  classname="fr.imag.adele.apam.mainApam.perfWire" >
			<relation field="apam" />
			<relation field="testPerf" resolve="exist">
				<constraints>
					<instance filter="(debit >= 5)"/>
				</constraints>
			</relation>

			<relation field="testSimple" />
			
			<relation field="testReaction" resolve="exist">
				<constraints>
					<instance filter="(debit >= $$need)"/>
				</constraints>
			</relation>

			<relation field="testPerfPrefere" >
				<preferences>
					<instance filter="(debit >= 1000)"/>
				</preferences>
			</relation>

			<definition name="need" type="int" default="7"/>
	</implementation>


	<implementation name="M"  classname="fr.imag.adele.apam.mainApam.MainApam" >
			<relation field="apam" />
			<relation field="testPerf" fail="wait" resolve="exist">
				<constraints>
					<instance filter="(debit >= 5)"/>
				</constraints>
			</relation>
			<relation field="testPerfPrefere" >
				<preferences>
					<instance filter="(debit >= 5)"/>
				</preferences>
			</relation>
	</implementation>

	<implementation name="Promotions"  classname="fr.imag.adele.apam.mainApam.Promotions" >
			<relation field="apam" />
	</implementation>


<!--    <apam-instance name="MainApam-Instance" implementation="MainApam" />  -->
 	
<!--  	<instance name="Promotions-Instance" implementation="Promotions" /> -->
</apam>
